{"schema_version":"stella.identity-context/v1","instance_id":"instance-synthetic","producer_id":"stella-runtime","consumer_id":"stella-fitness","source_revision":"source-synthetic-1","as_of":"2026-08-24T00:00:00Z","categories":["background","identity"],"entries":[{"id":"preferred-language","category":"background","content":"zh-CN","source_reference_ids":["source-user"]},{"id":"agent-name","category":"identity","content":"Stella","source_reference_ids":["source-identity"]}]}
